{
  "schema_version": 1,
  "artifact_type": "delivery_art_custody_receipt",
  "receipt_id": "artifact-custody-receipt:bbbbbbbbbbbbbbbbbbbbbbbb",
  "subject": {
    "artifact_type": "delivery_art_work_start_record",
    "artifact_id": "work-start:delivery-698-work-item-801",
    "delivery_id": "delivery-698",
    "content_digest": "sha256:f39d8b6f7c8a6355048c4435264b08dcdd04ce4dedf44c1fea7a8d85eb6dc23f",
    "registry_uri": "wgcf://artifacts/delivery-art/sha256/f39d8b6f7c8a6355048c4435264b08dcdd04ce4dedf44c1fea7a8d85eb6dc23f"
  },
  "issuer": {
    "owner_repo": "workspace-governance-control-fabric",
    "service_identity_ref": "service-identity://workspace-governance-control-fabric/dev-integration",
    "implementation_ref": "5555555555555555555555555555555555555555"
  },
  "storage": {
    "runtime_owner": "platform-engineering",
    "receipt_ref": "platform-storage://receipts/delivery-art-work-start-698-801",
    "persisted_at": "2026-08-08T10:10:58+08:00"
  },
  "integrity": {
    "canonicalization": "RFC8785",
    "algorithm": "sha256",
    "content_digest": "sha256:082dc71c93eefb15026d88a2b5bcafcfc68e8489f0e85c2fa4e803dfa9e4f680"
  },
  "custody": {
    "state": "durable",
    "backend": "wgcf-receipt-ledger",
    "uri": "wgcf://receipts/artifact-custody/bbbbbbbbbbbbbbbbbbbbbbbb-082dc71c93eefb15026d88a2b5bcafcfc68e8489f0e85c2fa4e803dfa9e4f680.json",
    "persisted_at": "2026-08-08T10:10:59+08:00",
    "supersedes": null
  }
}
