{
  "schema_version": 1,
  "artifact_type": "delivery_art_custody_receipt",
  "receipt_id": "artifact-custody-receipt:cccccccccccccccccccccccc",
  "subject": {
    "artifact_type": "art_review_packet",
    "artifact_id": "review-packet:delivery-698-work-item-801",
    "delivery_id": "delivery-698",
    "content_digest": "sha256:72680a6fb28464ae15b2dee540f70d9f7b1500eac0cc315341574179667c4cde",
    "registry_uri": "wgcf://artifacts/delivery-art/sha256/72680a6fb28464ae15b2dee540f70d9f7b1500eac0cc315341574179667c4cde"
  },
  "issuer": {
    "owner_repo": "workspace-governance-control-fabric",
    "service_identity_ref": "service-identity://workspace-governance-control-fabric/dev-integration",
    "implementation_ref": "5555555555555555555555555555555555555555"
  },
  "storage": {
    "runtime_owner": "platform-engineering",
    "receipt_ref": "platform-storage://receipts/delivery-art-review-698-801-merge-ready",
    "persisted_at": "2026-08-08T11:15:58+08:00"
  },
  "integrity": {
    "canonicalization": "RFC8785",
    "algorithm": "sha256",
    "content_digest": "sha256:f82aad6afee5a42b80466a2d189172548e91e70a5a0acbeaee8234797a60943a"
  },
  "custody": {
    "state": "durable",
    "backend": "wgcf-receipt-ledger",
    "uri": "wgcf://receipts/artifact-custody/cccccccccccccccccccccccc-f82aad6afee5a42b80466a2d189172548e91e70a5a0acbeaee8234797a60943a.json",
    "persisted_at": "2026-08-08T11:15:59+08:00",
    "supersedes": null
  }
}
