{
  "schema_version": 1,
  "artifact_type": "delivery_art_custody_receipt",
  "receipt_id": "artifact-custody-receipt:aaaaaaaaaaaaaaaaaaaaaaaa",
  "subject": {
    "artifact_type": "delivery_art_architecture_packet",
    "artifact_id": "architecture-packet:delivery-698-v1",
    "delivery_id": "delivery-698",
    "content_digest": "sha256:183c424105839de5defa3a67fa234ef5aa64ed8b620a31b5d357f3ff2888993a",
    "registry_uri": "wgcf://artifacts/delivery-art/sha256/183c424105839de5defa3a67fa234ef5aa64ed8b620a31b5d357f3ff2888993a"
  },
  "issuer": {
    "owner_repo": "workspace-governance-control-fabric",
    "service_identity_ref": "service-identity://workspace-governance-control-fabric/dev-integration",
    "implementation_ref": "5555555555555555555555555555555555555555"
  },
  "storage": {
    "runtime_owner": "platform-engineering",
    "receipt_ref": "platform-storage://receipts/delivery-art-architecture-698-v1",
    "persisted_at": "2026-08-08T10:05:58+08:00"
  },
  "integrity": {
    "canonicalization": "RFC8785",
    "algorithm": "sha256",
    "content_digest": "sha256:40374a17f07ef2c655a23c89bf103a65bb4c38a5ed03d8650b281d1e843279fc"
  },
  "custody": {
    "state": "durable",
    "backend": "wgcf-receipt-ledger",
    "uri": "wgcf://receipts/artifact-custody/aaaaaaaaaaaaaaaaaaaaaaaa-40374a17f07ef2c655a23c89bf103a65bb4c38a5ed03d8650b281d1e843279fc.json",
    "persisted_at": "2026-08-08T10:05:59+08:00",
    "supersedes": null
  }
}
