{
  "schema_version": 1,
  "artifact_type": "delivery_art_custody_receipt",
  "receipt_id": "artifact-custody-receipt:dddddddddddddddddddddddd",
  "subject": {
    "artifact_type": "art_review_packet",
    "artifact_id": "review-packet:delivery-698-work-item-801",
    "delivery_id": "delivery-698",
    "content_digest": "sha256:990c029659f4c941d83367ea49353ae71585a626276228241bfaebc9017f27e5",
    "registry_uri": "wgcf://artifacts/delivery-art/sha256/990c029659f4c941d83367ea49353ae71585a626276228241bfaebc9017f27e5"
  },
  "issuer": {
    "owner_repo": "workspace-governance-control-fabric",
    "service_identity_ref": "service-identity://workspace-governance-control-fabric/dev-integration",
    "implementation_ref": "5555555555555555555555555555555555555555"
  },
  "storage": {
    "runtime_owner": "platform-engineering",
    "receipt_ref": "platform-storage://receipts/delivery-art-review-698-801-finalized",
    "persisted_at": "2026-08-08T11:32:58+08:00"
  },
  "integrity": {
    "canonicalization": "RFC8785",
    "algorithm": "sha256",
    "content_digest": "sha256:0088202ce178ea1ba1fc0f66c73a59c809f7af60e51f131320d638d9314136ac"
  },
  "custody": {
    "state": "durable",
    "backend": "wgcf-receipt-ledger",
    "uri": "wgcf://receipts/artifact-custody/dddddddddddddddddddddddd-0088202ce178ea1ba1fc0f66c73a59c809f7af60e51f131320d638d9314136ac.json",
    "persisted_at": "2026-08-08T11:32:59+08:00",
    "supersedes": null
  }
}
